<?xml version="1.0" ?>

<!-- Specification of FAP visualization module for GTK -->
<!--
     -->

<!DOCTYPE  iobject SYSTEM "/usr/share/fapws/conf/objspec.dtd"> 

<iobject type="none" id="main">
    <out id="output"/>
    <logspec  event="cre"> <logdata id="new"/> </logspec>
    <logspec event="upd"> <logdata id="cur"/> <logdata id="new"/> </logspec> 
    <state type="StVectF" id="test_coord_pf" init="{1.0,3.0}">
	<logspec  event="cre"> <logdata id="new"/> </logspec>
	<logspec event="upd"> <logdata id="cur"/> <logdata id="new"/> </logspec> 
	<inp id="self"/>
	<trans> add inp self {1.0,1.0} </trans>
    </state>
    <conn id="state:test_coord_pf/inp:self" pair="state:test_coord_pf/out:output"/>
    <ext id="out:output" pair="state:test_coord_pf/out:output"/>
</iobject> <!-- main -->

