<?xml version="1.0" ?>

<!-- Specification of FAP environment for unit test for embedded module "Vector" -->
<!--
     -->

<!DOCTYPE  iobject SYSTEM "/usr/share/fapws/conf/objspec.dtd"> 

<iobject type="none" id="main_test">

    <out id="rock">
	<src id="coord"/> <src id="mass"/> 
    </out>

    <logspec event="tran"> <logdata id="trex"/></logspec> 

    <iobject type="file:../modules/vector.xml#vector" id="my_vector" quiet="yes"/> 

    <iobject type="none" id="Rock" quiet="yes"> 
	<out id="coord"/>
	<out id="mass"/>
	<out id="outp"> <src id="coord"/> <src id="mass"/> </out>

	<logspec  event="cre"> <logdata id="new"/> </logspec>

	<trans>
	    let KAccDef :: Vector := 0.0 -8.9
	</trans>

	<state type="Float" id="mass" init="2.0"> 
	    <logspec event="upd"> <logdata id="new"/> </logspec> 
	</state>

	<state type="Vector" id="coord" init="0.0 1.0"> 
	    <logspec event="upd"> <logdata id="cur"/> <logdata id="new"/> </logspec> 
	    <logspec event="tran"> <logdata id="trex"/></logspec> 
	    <inp id="self"/> <inp id="velocity"/> 
	    <trans> 
		let coord :: Vector := add inp self inp velocity
		let bang :: TBool := le VectY coord 0.0
		if bang KVect0 coord
	    </trans>
	</state>

	<state type="Vector" id="velocity" init="80.0 80.0"> 
	    <logspec event="upd"> <logdata id="cur"/> <logdata id="new"/> </logspec> 
	    <logspec event="tran"> <logdata id="trex"/></logspec> 
	    <inp id="self"/><inp id="coord"/> 
	    <trans> 
		let bang :: TBool := le VectY inp coord 0.0
		let vel :: Vector := add inp self KAccDef
		if bang KVect0 vel
	    </trans>
	</state>

	<conn id="state:coord/inp:self" pair="state:coord/out:output"/> 
	<conn id="state:coord/inp:velocity" pair="state:velocity/out:output"/> 
	<conn id="state:velocity/inp:coord" pair="state:coord/out:output"/> 
	<conn id="state:velocity/inp:self" pair="state:velocity/out:output"/> 

	<ext id="out:coord" pair="state:coord/out:output"/>
	<ext id="out:mass" pair="state:mass/out:output"/>

    </iobject> <!-- Rock -->

    <iobject type="Rock" id="rock_1" > <chg node="state:mass" attr="init" val="7"/> </iobject>

    <extc id="out:rock"> <srcext id="coord" pair="rock_1/out:coord"/> <srcext id="mass" pair="rock_1/out:mass"/> </extc>

</iobject> <!-- test -->

