<?xml version="1.0" ?>

<!-- Specification of FAP environment for unit test for extended inputs and object mutation -->
<!--
     There are several "snails" that are crawling to one direction
     The the less mass of snail the much its velocity  
     The snail that is crawling first eat more food and thus increase its mass
     The snail that falls behind gets less food and thus loosing its mass
     -->

<!DOCTYPE  iobject SYSTEM "/usr/share/fapws/conf/objspec.dtd"> 

<iobject type="none" id="main_test">
    <iobject type="none" id="snail" quiet="yes"> 
	<inp id="coord_others"/>
	<out id="coord"/>

	<logspec  event="cre"> <logdata id="new"/> </logspec>

	<state type="StUint32" id="mass" transf="trans_mass" init="2"> 
	    <logspec event="upd"> <logdata id="new"/> </logspec> 
	    <inp id="coord_self"/> <inp id="coord_others"/> </state>

	<state type="StUint32" id="coord" len="4" transf="trans_coord" init="0"> 
	    <logspec event="upd"> <logdata id="cur"/> <logdata id="new"/> </logspec> 
	    <inp id="self"/> <inp id="mass"/> 
	</state>

	<conn id="state:mass/inp:coord_self" pair="state:coord/out:output"/> 
	<conn id="state:coord/inp:self" pair="state:coord/out:output"/> 
	<conn id="state:coord/inp:mass" pair="state:mass/out:output"/>

	<ext id="inp:coord_others" pair="state:mass/inp:coord_others"/>
	<ext id="out:coord" pair="state:coord/out:output"/>

    </iobject> <!-- snail -->

    <iobject type="snail" id="snail_1" > <chg node="state:mass" attr="init" val="7"/> </iobject>
    <iobject type="snail" id="snail_2" > <chg node="state:mass" attr="init" val="3"/> </iobject>
    <iobject type="snail" id="snail_3" > <chg node="state:mass" attr="init" val="16"/> </iobject>

    <conn id="snail_1/inp:coord_others" pair="snail_2/out:coord"/><conn id="snail_1/inp:coord_others" pair="snail_3/out:coord"/>
    <conn id="snail_2/inp:coord_others" pair="snail_1/out:coord"/> <conn id="snail_2/inp:coord_others" pair="snail_3/out:coord"/>
    <conn id="snail_3/inp:coord_others" pair="snail_1/out:coord"/> <conn id="snail_3/inp:coord_others" pair="snail_2/out:coord"/>

</iobject> <!-- test -->

