<?xml version="1.0" ?>

<!-- Unit test for connections -->
<!--
     There are several "snails" that are crawling to one direction
     The the less mass of snail the much its velocity  
     The snail that is crawling first eat more food and thus increase its mass
     The snail that falls behind gets less food and thus loosing its mass
     Also the snail can be frugal, which doesn't eat the whole portion, thus more food remains for the followers 

     The following use cases are tested:
     1. Object output extending of multiple state outputs to one bus
     2. Object input extending of multiple state inputs to one bus
     3. State input multiple connestion to outputs (snail.mass.neighbor to snail.out) 

     -->

 <!-- State [mass], inputs
 coord_self - corrdinates of snail
 frugal - if the snail is frugal
 neighbor - status of other snails: coordinate and sign of frugality -->

<!DOCTYPE  iobject SYSTEM "/usr/share/fapws/conf/objspec.dtd"> 

<iobject type="none" id="main_test">
    <iobject type="none" id="snail" quiet="yes"> 

	<inp id="neighbor">
	    <dest id="coord"/> <dest id="frugal"/> 
	</inp>
	<out id="coord"/>
	<!-- Custom output connection point: contains two pins on srcs: [coord] and [vip] -->
	<out id="outp">
	    <src id="coord"/> <src id="frugal"/> 
	</out>

	<logspec  event="cre"> <logdata id="new"/> </logspec>

	<state type="StUint32" id="mass" transf="trans_mass" init="2"> 
	    <logspec event="upd"> <logdata id="new"/> </logspec> 
	    <inp id="coord_self"/> <inp id="frugal"/> 
	    <inp id="neighbor"> 
		<dest id="coord"/> <dest id="frugal"/> 
	    </inp>
	</state>

	<state type="StUint32" id="coord" len="4" transf="trans_coord" init="0"> 
	    <logspec event="upd"> <logdata id="cur"/> <logdata id="new"/> </logspec> 
	    <inp id="self"/> <inp id="mass"/> 
	</state>

	<state type="StBool" id="frugal" len="4" transf="trans_frugal" init="0"> 
	    <logspec event="upd"> <logdata id="cur"/> <logdata id="new"/> </logspec> 
	    <inp id="self"/> <inp id="coord"/> <inp id="coord_other"/> 
	</state>

	<conn id="state:mass/inp:coord_self" pair="state:coord/out:output"/> 
	<conn id="state:mass/inp:frugal" pair="state:frugal/out:output"/> 
	<conn id="state:coord/inp:self" pair="state:coord/out:output"/> 
	<conn id="state:coord/inp:mass" pair="state:mass/out:output"/>
	<conn id="state:frugal/inp:self" pair="state:frugal/out:output"/>
	<conn id="state:frugal/inp:coord" pair="state:coord/out:output"/>

	<ext id="inp:neighbor" pair="state:mass/inp:neighbor"/>
	<ext id="out:coord" pair="state:coord/out:output"/>
	<extc id="out:outp">
	    <srcext id="coord" pair="state:coord/out:output"/>
	    <srcext id="frugal" pair="state:frugal/out:output"/>
	</extc>
	<extc id="inp:neighbor">
	    <dstext id="coord" pair="state:frugal/inp:coord_other"/>
	</extc>

    </iobject> <!-- snail -->

    <iobject type="snail" id="snail_1" > <chg node="state:mass" attr="init" val="7"/> </iobject>
    <iobject type="snail" id="snail_2" > <chg node="state:mass" attr="init" val="3"/> </iobject>
    <iobject type="snail" id="snail_3" > 
	<chg node="state:mass" attr="init" val="16"/> 
	<chg node="state:frugal" attr="init" val="True"/> 
    </iobject>

    <conn id="snail_1/inp:neighbor" pair="snail_2/out:outp"/><conn id="snail_1/inp:neighbor" pair="snail_3/out:outp"/>
    <conn id="snail_2/inp:neighbor" pair="snail_1/out:outp"/> <conn id="snail_2/inp:neighbor" pair="snail_3/out:outp"/>
    <conn id="snail_3/inp:neighbor" pair="snail_1/out:outp"/> <conn id="snail_3/inp:neighbor" pair="snail_2/out:outp"/>

</iobject> <!-- test -->

